{
  "$schema": "../fighter.schema.json",
  "schemaVersion": 1,
  "status": "ready",
  "id": "cactus",
  "kind": "3d",
  "order": 50,
  "identity": {
    "displayName": "Cactus",
    "archetype": "Thorn Guardian",
    "playstyle": "Projectiles, rolls, and defensive counters",
    "colors": {
      "primary": "#48a95f",
      "secondary": "#2d673d",
      "accent": "#f3d65c"
    }
  },
  "gameplay": {
    "size": {
      "width": 67,
      "height": 78
    },
    "spriteReferenceHeight": 132,
    "weight": 96,
    "dash": 1.58,
    "dashFrames": 10,
    "run": 1.5,
    "air": 0.92,
    "gravity": 0.096,
    "fall": 1.95,
    "fastFall": 2.75,
    "jump": 2.5,
    "doubleJump": 2.28,
    "jumpSquat": 4,
    "shortHop": 0.62,
    "reach": 1.08,
    "specials": {
      "neutral-special": {
        "label": "Flying Thorn",
        "damage": 7,
        "projectile": {
          "kind": "needle",
          "speed": 520,
          "gravity": 80,
          "lifetimeFrames": 95,
          "radius": 13,
          "absorbable": true
        }
      },
      "side-special": {
        "label": "Spiked Roll",
        "damage": 12,
        "specialMovement": {
          "kind": "ground-steered",
          "speed": 520
        },
        "radius": 52
      },
      "up-special": {
        "label": "Leaping Bloom",
        "damage": 9,
        "specialMovement": {
          "kind": "steered-rise",
          "riseSpeed": 630,
          "horizontalSpeed": 235,
          "steerFrames": 20
        },
        "radius": 48
      },
      "down-special": {
        "label": "Thorn Armor",
        "damage": 14,
        "startup": 6,
        "active": 14,
        "counters": true,
        "radius": 55
      }
    }
  },
  "visual": {
    "sourceFacing": "right",
    "attribution": "Cute Animated Monsters — Quaternius",
    "sourcePage": "https://quaternius.com/packs/cutemonsters.html",
    "license": {
      "id": "CC0-1.0",
      "url": "https://creativecommons.org/publicdomain/zero/1.0/"
    }
  },
  "effects": {
    "materials": {
      "neutral-special": "blade",
      "side-special": "wind",
      "up-special": "wind"
    },
    "traits": []
  }
}
